{
  "format": "cryo-container",
  "version": "2.1.0",
  "kind": "agent-package",
  "name": "Agent World 01",
  "contents": [
    {
      "path": "README.md",
      "type": "other",
      "size": 5067,
      "sha256": "17b75054556d8a43b1ec2a26fc9b72fc30b03f35a74d392defcafa62b82de5be"
    },
    {
      "path": "agent.afrost",
      "type": "other",
      "size": 1583,
      "sha256": "a7fc3f362c0ce1768b3c424508591508ac53f9209aa20c495ffd1caeec6a830b"
    },
    {
      "path": "boot.kosaction",
      "type": "other",
      "size": 1214,
      "sha256": "324425d7682fd982c45f3e7b4ed399dcc26c7e00720c78ec197ec9450810fb33"
    },
    {
      "path": "capabilities.json",
      "type": "other",
      "size": 184,
      "sha256": "a376cecf04802ae13385dbebe55c9b35bde86d23a6302800161c6e99be79bad3"
    },
    {
      "path": "scene/assets/models/box/box.gltf",
      "type": "other",
      "size": 3933,
      "sha256": "7313ecdbd7e579452a5133079051ccc35f2e89eee45f9bc322db9fdbabe2e554"
    },
    {
      "path": "scene/iris.xml",
      "type": "other",
      "size": 1777,
      "sha256": "03f269974f0e1be7f4f2ef239193fa008e5df3a98fb4c0898623f90e1d3e1ba4"
    },
    {
      "path": "scene/scenes/main.scene.json",
      "type": "other",
      "size": 651,
      "sha256": "762055ef76429d1a926cfe362f067e59956c98ad2e561cb488161f09ac6a5b1d"
    },
    {
      "path": "scene/scripts/boot.lua",
      "type": "script",
      "size": 224,
      "sha256": "7a22bcc29a621899a0307025edf4f2d4a7e704c74f0b95cdd87b2ad2c9570ae2"
    },
    {
      "path": "scene/shaders/atmosphere.frag.spv",
      "type": "other",
      "size": 17476,
      "sha256": "550106bab92698da17b0182565d2a014c90f3c87e101b6a5abeae39d6715b482"
    },
    {
      "path": "scene/shaders/billboard_expansion.geom.spv",
      "type": "other",
      "size": 6060,
      "sha256": "7536f2f745eb39f5cf141528e0a2ec67d104ce968ae14d19ae22af9ffe3c21d7"
    },
    {
      "path": "scene/shaders/coast_water.frag.spv",
      "type": "other",
      "size": 24392,
      "sha256": "d554f15e5ba246e71aa5d79b97ec4fef3a863d89fad113cdba243d4d09b58846"
    },
    {
      "path": "scene/shaders/composite.frag.spv",
      "type": "other",
      "size": 5952,
      "sha256": "f558e3dedced6e632dbb0e388294505058b07712bc038efe77bb697e89c6cfb1"
    },
    {
      "path": "scene/shaders/composite.vert.spv",
      "type": "other",
      "size": 1232,
      "sha256": "0bfbf8d4ded381ad0e20fddd1a8a62b86a926d0fa92fb187e43c4e7c019be1c2"
    },
    {
      "path": "scene/shaders/daily.frag.spv",
      "type": "other",
      "size": 26952,
      "sha256": "f5fe800c94f6953c7e3a2f89a14d595d22266ca3571ccdede4055007aec64043"
    },
    {
      "path": "scene/shaders/denoise_atrous.comp.spv",
      "type": "other",
      "size": 7328,
      "sha256": "f049d0b060e45b7e59cf17519652852411066e37336c65cfd014e5c4509d783f"
    },
    {
      "path": "scene/shaders/emissive_glow.frag.spv",
      "type": "other",
      "size": 16036,
      "sha256": "16ab72c473f1b01a6c25079b6d5e603a9aeefba33c049f659460b976308d2db9"
    },
    {
      "path": "scene/shaders/explosion.frag.spv",
      "type": "other",
      "size": 20324,
      "sha256": "c4e13ae0743f301f808b0f0752bd0cd8ffee64c63c5a080bcedbdd69a4267473"
    },
    {
      "path": "scene/shaders/filtercube.vert.spv",
      "type": "other",
      "size": 1044,
      "sha256": "8f9ca644c46aaa41b0e896ccec86cfab54d173c6000b690f0dff1d42d5451fa6"
    },
    {
      "path": "scene/shaders/fire.frag.spv",
      "type": "other",
      "size": 16144,
      "sha256": "7cba63224571badc351259570d38c86d52d18742ce6c2dd7cbeef2a9099aeecf"
    },
    {
      "path": "scene/shaders/fire.tesc.spv",
      "type": "other",
      "size": 3648,
      "sha256": "71214cd3c93eb76b694b7dd4d99344cd9ed431b1a8fc6be74367a93737145c68"
    },
    {
      "path": "scene/shaders/fire.tese.spv",
      "type": "other",
      "size": 11680,
      "sha256": "9f780999be3c0dd30cca9f34eac23fda464cc09ae3cc4431f8423f7811676ce8"
    },
    {
      "path": "scene/shaders/fluid.frag.spv",
      "type": "other",
      "size": 18360,
      "sha256": "686a36508f843a75cf1e98be56bb5bedbe8154f82154a8dfd00bc32602813a21"
    },
    {
      "path": "scene/shaders/fog_3d.frag.spv",
      "type": "other",
      "size": 16960,
      "sha256": "33283e1ae8e14060cd67fb616efe395c7f20ccbe3e59fdc92761c58a30499e8f"
    },
    {
      "path": "scene/shaders/forest_floor.frag.spv",
      "type": "other",
      "size": 29052,
      "sha256": "9b4ab7f6d860dd5562d99c403d80dd194a3b2e02af744bdabb9b1e4c6aa30dc0"
    },
    {
      "path": "scene/shaders/gbuffer_uv.frag.spv",
      "type": "other",
      "size": 1172,
      "sha256": "1a068f4a21cde83fdfb94236ba0f01ef5236180c362d5ca1e8c4283788f19b5c"
    },
    {
      "path": "scene/shaders/gbuffer_uv.vert.spv",
      "type": "other",
      "size": 1472,
      "sha256": "2ecde8116da174ccf08f61116d3a79a7e126021ebbc2ed9f73843f1bcfd183c2"
    },
    {
      "path": "scene/shaders/genbrdflut.frag.spv",
      "type": "other",
      "size": 8144,
      "sha256": "7f4071f8c66916ad0847e4b29558139f465246bc18cae1db0283ffb92fd65ae2"
    },
    {
      "path": "scene/shaders/genbrdflut.vert.spv",
      "type": "other",
      "size": 1232,
      "sha256": "0bfbf8d4ded381ad0e20fddd1a8a62b86a926d0fa92fb187e43c4e7c019be1c2"
    },
    {
      "path": "scene/shaders/glass.frag.spv",
      "type": "other",
      "size": 23404,
      "sha256": "ec55017eb28b05027e9604b3290bf7f11821c4b22bda2cab152320cb21b1e34b"
    },
    {
      "path": "scene/shaders/grass_blades.geom.spv",
      "type": "other",
      "size": 9796,
      "sha256": "b44412d3f2ebd571a24e5e7976da3562f52d7c3d45423fbd3425aa6ce47d60b2"
    },
    {
      "path": "scene/shaders/iridescent.frag.spv",
      "type": "other",
      "size": 21996,
      "sha256": "dabda6a0b54d0db319c6d572633cc423594821b2faeaf11f58d3d23d42441889"
    },
    {
      "path": "scene/shaders/irradiancecube.frag.spv",
      "type": "other",
      "size": 2856,
      "sha256": "daabd7878a0f433b847b0c3344835069996cb983b64375046beaec93f8f8de21"
    },
    {
      "path": "scene/shaders/lava.frag.spv",
      "type": "other",
      "size": 23232,
      "sha256": "079e83971af6f4239d10db1d2166b29d58765650955e3c2d917a6c59836af684"
    },
    {
      "path": "scene/shaders/normal_visualization.geom.spv",
      "type": "other",
      "size": 5716,
      "sha256": "69dd4a75d3ff6797d23a74180270171624fbf15af50ded43625ddf770e2da9cc"
    },
    {
      "path": "scene/shaders/outline.frag.spv",
      "type": "other",
      "size": 424,
      "sha256": "8ac296fd8855360d21dc1aa5109b4d390fdc290bde447ae2f031e684567b1810"
    },
    {
      "path": "scene/shaders/outline.vert.spv",
      "type": "other",
      "size": 5388,
      "sha256": "a409b49f6d08397d88c7e6aca4423b471a8565af4e9c1cb6ce5eb7a8d8112d3f"
    },
    {
      "path": "scene/shaders/particle.frag.spv",
      "type": "other",
      "size": 2976,
      "sha256": "6530c1bfea83c018795f9d59f3e310655bc6e6c6fa7830849d14844ec955617b"
    },
    {
      "path": "scene/shaders/particle.vert.spv",
      "type": "other",
      "size": 2940,
      "sha256": "6181057fb66d05012f3557e078bff68771362e9e3036332959bc212ceb2517bd"
    },
    {
      "path": "scene/shaders/particle_simulation.comp.spv",
      "type": "other",
      "size": 10780,
      "sha256": "d9baa48a7a0aa635f350f65a7eb12414e593bb74e0fe3cef1f0b3dab226a445a"
    },
    {
      "path": "scene/shaders/pbr.vert.spv",
      "type": "other",
      "size": 9880,
      "sha256": "1b4bd7cca324d4faa198c3cdb9fb9b85516e831054c1b77daaaa912be45e1f24"
    },
    {
      "path": "scene/shaders/pbr_bindless.frag.spv",
      "type": "other",
      "size": 40644,
      "sha256": "2128254af71bc804f0b788d1f8261c1784c4619ee4ad8cb81e5b464ca51db364"
    },
    {
      "path": "scene/shaders/pbr_bindless.vert.spv",
      "type": "other",
      "size": 9952,
      "sha256": "1b2140a1bae73fb94cf5fc076e2e040e16b4315d8d2d52fc68c4a87116d64109"
    },
    {
      "path": "scene/shaders/pbr_bindless_lod1.frag.spv",
      "type": "other",
      "size": 15128,
      "sha256": "31fb21cdc78b9c4bd7f7bd4e790f4b8fadbf4765d6b4edb70fe3a52ae7f9a088"
    },
    {
      "path": "scene/shaders/pbr_bindless_lod2.frag.spv",
      "type": "other",
      "size": 8340,
      "sha256": "b539127969744e95da63efc4ce8d76ddcec95fc1f6cb695669f48c1cf49bc7ab"
    },
    {
      "path": "scene/shaders/pbr_khr.frag.spv",
      "type": "other",
      "size": 36892,
      "sha256": "4afc94ad3d8e07e8f9cd892542858b8d70ebf59dccaf297f9291e0b8b07772de"
    },
    {
      "path": "scene/shaders/pbr_pn.tesc.spv",
      "type": "other",
      "size": 9492,
      "sha256": "92e93a210e1b489ec540bc017d2b900268db82ec7ffa4157b7745de1e1d1ecce"
    },
    {
      "path": "scene/shaders/pbr_pn.tese.spv",
      "type": "other",
      "size": 15812,
      "sha256": "29f54d7b6c2441ab2a85cc289495537157fad58791b93f87c7cd43e758dc8008"
    },
    {
      "path": "scene/shaders/pbr_pn.vert.spv",
      "type": "other",
      "size": 9180,
      "sha256": "8edd3add1f4d57f2a2e152dbf7e10b082e146973068707218ed64cfdd229b73f"
    },
    {
      "path": "scene/shaders/post_bloom.comp.spv",
      "type": "other",
      "size": 6400,
      "sha256": "48b4185918d4494191b387a290e1a98508918ea2da4d81633e9024b5f65299a0"
    },
    {
      "path": "scene/shaders/prefilterenvmap.frag.spv",
      "type": "other",
      "size": 9060,
      "sha256": "952375d069e2f2001c57a5a46ccfd1df0753285f2a602f8bd1cdbb1dd899ae14"
    },
    {
      "path": "scene/shaders/raytrace_ao.comp.spv",
      "type": "other",
      "size": 16264,
      "sha256": "4c689837b8fb4f69f4057ef535b2ffa7c204d9ba5d7195096200872c6cb51694"
    },
    {
      "path": "scene/shaders/raytrace_direct_light.comp.spv",
      "type": "other",
      "size": 21068,
      "sha256": "5c70d305f81b1b7d0e324b737a78a2ccb2a59bf3bf47615eac4dc7a37a8089ac"
    },
    {
      "path": "scene/shaders/raytrace_indirect_bounce.comp.spv",